{"schema":"sns.belief-event.v1","belief_event_id":"BEL-20260830T150210000000Z-meta-loss-boundedness-c620c4e560e3d321fc4b","belief_key":"META.loss_bounded_relay_value","evidence_ids":["EVID-20260830T150210000000Z-meta-beam-link-loss-73e5133d78e524c93234"],"magnitude":0.09,"confidence":0.88,"effect":"strengthen","rationale":"The accepted synthetic sweep is useful at only four of twelve declared angle/error points, with eight loss-limited and one net-negative case. This strengthens the requirement that relay value be conditioned on explicit loss and control-cost budgets, without asserting physical SNS power-beam performance.","recorded_at":"2026-08-30T15:02:10Z"}
