{
  "schema": "sns.belief-event.v1",
  "belief_event_id": "BEL-20260823T145740000000Z-stor-fast-rotator-viability-6a15e6ec0027af2ee0af",
  "belief_key": "STOR.fast_rotator_surface_viability",
  "evidence_ids": ["EVID-20260823T145740000000Z-stor-fast-rotator-falsifier-a9e13484396417d85050"],
  "magnitude": -0.28,
  "confidence": 0.93,
  "effect": "weaken",
  "rationale": "The accepted review-corrected constraint-cost experiment triggers its declared falsifier: no declared thermal case simultaneously survives the inherited 15-minute shadow model and meets illuminated rejection at the reference temperature. This weakens only viability under the declared synthetic grid; it does not establish hosted operation, larger geometry, or a revised material assumption.",
  "recorded_at": "2026-08-23T14:57:40Z"
}